[
  {
    "schemaVersion": 1,
    "id": "first-block-story",
    "title": "First Block Story",
    "subtitle": "Find a beginning, change, and ending on one familiar block.",
    "outcome": "A 60- to 120-second vertical micro-documentary with a clear three-part story.",
    "theme": "documentary",
    "difficulty": "beginner",
    "aspectRatio": "9:16",
    "durationTargetSeconds": { "min": 60, "ideal": 90, "max": 120 },
    "tags": ["documentary", "one-block", "beginner"],
    "shotPrompts": [
      { "id": "opening-wide-context", "index": 0, "title": "Open with the whole block", "structureRole": "beginning_context", "direction": "Film a steady wide shot that shows where the story happens.", "hint": "Hold long enough for the viewer to understand the place before anything changes.", "icon": "building.2.fill", "targetSeconds": 10 },
      { "id": "main-subject-action", "index": 1, "title": "Choose one moving subject", "structureRole": "beginning_subject", "direction": "Follow one person, animal, vehicle, shadow, or object in motion.", "hint": "Keep the subject easy to track and avoid digital zoom.", "icon": "figure.walk", "targetSeconds": 12 },
      { "id": "closer-detail-clue", "index": 2, "title": "Cut closer to a clue", "structureRole": "middle_detail", "direction": "Film a detail that reveals texture, mood, or routine.", "hint": "Choose something that answers what this place really feels like.", "icon": "viewfinder", "targetSeconds": 10 },
      { "id": "sound-of-place", "index": 3, "title": "Record the block's sound", "structureRole": "middle_atmosphere", "direction": "Hold still and capture clean ambient sound from the block.", "hint": "Traffic, birds, footsteps, machines, wind, or silence can bridge the edit.", "icon": "waveform", "targetSeconds": 8 },
      { "id": "small-change", "index": 4, "title": "Find one small change", "structureRole": "middle_turn", "direction": "Film something that changes from the opening.", "hint": "A person leaving, a light shifting, or a task finishing is enough.", "icon": "arrow.triangle.2.circlepath", "targetSeconds": 15 },
      { "id": "reaction-or-result", "index": 5, "title": "Show the result", "structureRole": "ending_resolution", "direction": "Film what the change leaves behind.", "hint": "Make the difference from the opening visible in one simple frame.", "icon": "checkmark.seal.fill", "targetSeconds": 15 },
      { "id": "final-held-image", "index": 6, "title": "End on a held image", "structureRole": "ending_final_frame", "direction": "Choose one calm final frame and hold it without moving.", "hint": "Do not add a new idea; let the viewer sit with the ending.", "icon": "pause.rectangle.fill", "targetSeconds": 20 }
    ],
    "guidance": { "structure": "Establish the block, observe one change, then show what it leaves behind.", "capture": "Shoot vertically, hold shots steady, and collect one clean ambient sound clip.", "assembly": "Keep prompts in order and let the change and final image breathe.", "export": "Target 90 seconds in 9:16 and review the private local export before sharing." },
    "assembly": { "pacingStyle": "rhythmic", "editStyle": "standard", "useAmbientSoundtrack": true }
  },
  {
    "schemaVersion": 1,
    "id": "noir-shadow-mystery",
    "title": "Noir Shadow Mystery",
    "subtitle": "Turn shadows and ordinary details into an unresolved mystery.",
    "outcome": "A tense vertical mystery built from place, evidence, and one unanswered ending.",
    "theme": "noir",
    "difficulty": "beginner",
    "aspectRatio": "9:16",
    "durationTargetSeconds": { "min": 60, "ideal": 75, "max": 105 },
    "tags": ["noir", "mystery", "shadows"],
    "shotPrompts": [
      { "id": "long-shadow", "index": 0, "title": "Establish the shadow", "structureRole": "beginning_context", "direction": "Film the longest shadow you can find as an establishing shot.", "hint": "Use strong side light and keep the source just outside the frame.", "icon": "moon.fill", "targetSeconds": 10 },
      { "id": "pattern-evidence", "index": 1, "title": "Collect visual evidence", "structureRole": "beginning_clue", "direction": "Shoot a repeating pattern like it is evidence.", "hint": "Grids, tiles, or windows can suggest order and obsession.", "icon": "square.grid.3x3.fill", "targetSeconds": 10 },
      { "id": "ordinary-hands", "index": 2, "title": "Watch the hands", "structureRole": "middle_character", "direction": "Capture hands doing something ordinary without revealing the whole person.", "hint": "Keys, a cup, or a nervous gesture can imply a hidden story.", "icon": "hand.raised.fill", "targetSeconds": 10 },
      { "id": "ominous-sound", "index": 3, "title": "Gather ominous sound", "structureRole": "middle_atmosphere", "direction": "Record the most ominous ambient sound nearby.", "hint": "Traffic drone, wind, or a distant siren can carry the scene.", "icon": "waveform", "targetSeconds": 8 },
      { "id": "secret-object", "index": 4, "title": "Reveal the object", "structureRole": "middle_reveal", "direction": "Shoot one ordinary object as if it holds a secret.", "hint": "Move close and remove distracting context.", "icon": "magnifyingglass", "targetSeconds": 10 },
      { "id": "distorted-reflection", "index": 5, "title": "Distort the truth", "structureRole": "ending_turn", "direction": "Film a reflection in glass, water, or metal.", "hint": "A distorted double should make the earlier clues feel uncertain.", "icon": "drop.fill", "targetSeconds": 12 },
      { "id": "retreat-ending", "index": 6, "title": "Leave it unresolved", "structureRole": "ending_final_frame", "direction": "End with a slow retreat from the scene.", "hint": "Let the camera drift backward without explaining the mystery.", "icon": "arrow.backward", "targetSeconds": 15 }
    ],
    "guidance": { "structure": "Open with place, build suspicion through details, and leave one question unanswered.", "capture": "Seek contrast, silhouettes, reflections, and isolated details.", "assembly": "Cut from wide to evidence to reflection; use the ambient recording as a mood bed.", "export": "Target 75 seconds in 9:16 and keep the ending unresolved." },
    "assembly": { "pacingStyle": "slow_cinema", "editStyle": "standard", "useAmbientSoundtrack": true }
  },
  {
    "schemaVersion": 1,
    "id": "small-romance",
    "title": "Small Romance",
    "subtitle": "Build a tender story from light, gestures, and things that belong together.",
    "outcome": "A warm short film that moves from discovery to longing to an open final image.",
    "theme": "romance",
    "difficulty": "beginner",
    "aspectRatio": "4:5",
    "durationTargetSeconds": { "min": 60, "ideal": 90, "max": 120 },
    "tags": ["romance", "light", "gesture"],
    "shotPrompts": [
      { "id": "soft-light", "index": 0, "title": "Find soft light", "structureRole": "beginning_context", "direction": "Film the softest light you can find.", "hint": "Window light, a lamp through curtains, or late sun all work.", "icon": "sun.max.fill", "targetSeconds": 12 },
      { "id": "paired-things", "index": 1, "title": "Find a pair", "structureRole": "beginning_subject", "direction": "Capture two things that seem to belong together.", "hint": "Matching colors, parallel paths, or a pair of objects can imply a relationship.", "icon": "heart.fill", "targetSeconds": 12 },
      { "id": "tender-gesture", "index": 2, "title": "Notice tenderness", "structureRole": "middle_character", "direction": "Film a small gesture of care, real or implied.", "hint": "Keep faces optional and let the gesture carry the feeling.", "icon": "hands.and.sparkles.fill", "targetSeconds": 12 },
      { "id": "warm-sound", "index": 3, "title": "Record warmth", "structureRole": "middle_atmosphere", "direction": "Record a sound that feels warm or familiar.", "hint": "Laughter, birds, leaves, or room tone can connect the images.", "icon": "waveform", "targetSeconds": 8 },
      { "id": "living-detail", "index": 4, "title": "Honor a living detail", "structureRole": "middle_development", "direction": "Film one flower, plant, animal, or person with patient attention.", "hint": "Get close enough to notice a detail others might miss.", "icon": "leaf.fill", "targetSeconds": 14 },
      { "id": "longing-motion", "index": 5, "title": "Create longing", "structureRole": "ending_turn", "direction": "Film movement that feels like someone or something leaving.", "hint": "A closing door or a figure walking away can create the turn.", "icon": "figure.walk", "targetSeconds": 14 },
      { "id": "open-sky", "index": 6, "title": "Open the ending", "structureRole": "ending_final_frame", "direction": "End by looking upward at sky, trees, or open space.", "hint": "Let the final frame breathe rather than resolving everything.", "icon": "arrow.up", "targetSeconds": 18 }
    ],
    "guidance": { "structure": "Move from discovery to connection, then let one departure open the ending.", "capture": "Use soft natural light and avoid staging gestures that feel uncomfortable.", "assembly": "Favor gentle cuts and keep the warm sound beneath the final images.", "export": "Target 90 seconds in 4:5 with comfortable holds and no rushed ending." },
    "assembly": { "pacingStyle": "slow_cinema", "editStyle": "standard", "useAmbientSoundtrack": true }
  },
  {
    "schemaVersion": 1,
    "id": "observational-portrait",
    "title": "Observational Portrait",
    "subtitle": "Introduce a person through place, action, and revealing details.",
    "outcome": "A respectful horizontal portrait that shows what someone does without requiring an interview.",
    "theme": "documentary",
    "difficulty": "intermediate",
    "aspectRatio": "16:9",
    "durationTargetSeconds": { "min": 60, "ideal": 90, "max": 120 },
    "tags": ["documentary", "portrait", "observation"],
    "shotPrompts": [